{
  "version": "v2.1",
  "created_at": "2025-11-01T12:00:00Z",
  "created_by": "thresholds-bot",
  "description": "Baseline thresholds for Phase 0-4 deployment.",
  "rules": [
    {
      "test_name": "single_leg_squat",
      "angle_min": 20,
      "angle_max": 120,
      "stability_min": 75,
      "warn_threshold": 10,
      "invalid_threshold": 20
    }
  ]
}
